{
  "caseId": "C02",
  "caseRef": {
    "text": "写一段关于这个功能的介绍文档",
    "expectations": [
      "组织内容",
      "说明功能",
      "规划文档结构"
    ]
  },
  "level1": {
    "schemaVersion": "0.1",
    "directive": {
      "pattern": "none",
      "goals": [],
      "constraints": [],
      "outputStyle": "default"
    }
  },
  "level2": null,
  "changelog": [
    {
      "date": "2026-07-15T01:21:23.771Z",
      "reason": "v0.1 initial golden capture from Benchmark v0.1",
      "author": "golden-dataset-generator",
      "level": "l1"
    }
  ],
  "createdAt": "2026-07-15T01:21:23.771Z",
  "updatedAt": "2026-07-15T01:21:23.771Z"
}
