{
  "caseId": "Q09",
  "caseRef": {
    "text": "Explain how the event loop works in JavaScript.",
    "expectations": [
      "解释机制",
      "描述流程",
      "说明关键概念"
    ]
  },
  "level1": {
    "schemaVersion": "0.1",
    "directive": {
      "pattern": "none",
      "goals": [],
      "constraints": [],
      "outputStyle": "default"
    }
  },
  "level2": null,
  "changelog": [
    {
      "date": "2026-07-15T01:21:23.771Z",
      "reason": "v0.1 initial golden capture from Benchmark v0.1",
      "author": "golden-dataset-generator",
      "level": "l1"
    }
  ],
  "createdAt": "2026-07-15T01:21:23.771Z",
  "updatedAt": "2026-07-15T01:21:23.771Z"
}
